{
  "schema_version":"1.0.0","knowledge_need_id":"kn_repository","question":"Which test command does this repository declare?","why_it_matters":"The next validation command must be correct.","scope":{"repository":"current repository package metadata","dependencies":[],"versions":[],"usage":"package scripts","breadth":"narrow"},"freshness":{"requirement":"none","as_of":null},"materiality":"low","consequence":"low","security":"none","reversibility":"easy","authority":{"level":"repository","proof":"record"},"budget":{"cost":"minimal","context":"minimal","max_external_researchers":0},"known_facts":["The repository contains package metadata."],"stop_conditions":["A declared test command is found."],"escalation_conditions":["Package metadata is absent or contradictory."]}
