{"schema_version":"1.0.0","knowledge_need_id":"kn_bad","question":"What should we know?","why_it_matters":"It might matter.","scope":{"repository":"repo","dependencies":[],"versions":[],"usage":"unknown","breadth":"narrow"},"freshness":{"requirement":"none","as_of":null},"materiality":"low","consequence":"low","security":"none","reversibility":"easy","authority":{"level":"repository","proof":"record"},"budget":{"cost":"minimal","context":"minimal","max_external_researchers":0},"known_facts":[],"stop_conditions":[],"escalation_conditions":[]}
