{
  "schema_version":"1.0.0","knowledge_need_id":"kn_broad","question":"Which migration strategy is safe across all supported integrations?","why_it_matters":"The choice affects compatibility across the product surface.","scope":{"repository":"all integration boundaries","dependencies":["multiple external services"],"versions":["all supported versions"],"usage":"cross-system migration planning","breadth":"broad"},"freshness":{"requirement":"recent","as_of":null},"materiality":"high","consequence":"high","security":"relevant","reversibility":"hard","authority":{"level":"independent","proof":"independent_corroboration"},"budget":{"cost":"generous","context":"generous","max_external_researchers":8},"known_facts":["Several integrations have distinct compatibility constraints."],"stop_conditions":["All material compatibility branches are covered."],"escalation_conditions":["Coverage gaps or conflicts remain across integrations."]}
