{
  "schema_version":"1.0.0","knowledge_need_id":"kn_high_risk","question":"Which current security requirement applies to this authentication boundary?","why_it_matters":"A wrong interpretation could expose protected data.","scope":{"repository":"authentication boundary","dependencies":["identity-provider"],"versions":["current"],"usage":"production authorization flow","breadth":"narrow"},"freshness":{"requirement":"current","as_of":null},"materiality":"critical","consequence":"critical","security":"high","reversibility":"hard","authority":{"level":"primary","proof":"independent_corroboration"},"budget":{"cost":"generous","context":"generous","max_external_researchers":8},"known_facts":["The boundary protects production data."],"stop_conditions":["The applicable requirement and scope are independently established."],"escalation_conditions":["Any conflict, gap, or unverified security consequence remains."]}
