{
  "schema_version":"1.0.0","knowledge_need_id":"kn_external","question":"What is the current official release date for this dependency?","why_it_matters":"The integration must use the current supported release.","scope":{"repository":"current integration","dependencies":["example-package"],"versions":["current"],"usage":"runtime dependency compatibility","breadth":"narrow"},"freshness":{"requirement":"current","as_of":null},"materiality":"medium","consequence":"medium","security":"none","reversibility":"moderate","authority":{"level":"official","proof":"citation"},"budget":{"cost":"bounded","context":"bounded","max_external_researchers":1},"known_facts":["The package is declared by the target integration."],"stop_conditions":["An official release record answers the date."],"escalation_conditions":["Official records disagree or are unavailable."]}
